objectid,title,editors,creator,issue_number,date,subject,publisher,identifier,type,format,rights,rightsstatement,language,digital specifications,cdm_url,cdmid,display_template,filename,object_location,image_small,image_thumb
fugue-2021-n61,Fugue 61 (2021),"Newman, Emmy; Shearer, Clare; Pfau, Steven; Favazzo, Cady; Fund, Court; Croce, Libby; Teague, Alexandra; Muise, Milo; Cloepfil, Georgia; Stewart, Sean; Wotton, Abigail; Eddy, Zach; Fitch, Joely; Corgatelli, Jordan; Doty, Jessica; Falk, Karin; Harwood, Jenna; Lemesurier, Gladys; Lolley, Megan; Lucas, Courtney; Piper, Katie; Schonewald, Marie; Shaw, Tekla; Skewis, Kailen; Terry, Kade; Harrison, Keoni Tarbet; Jensen, Riley; Stoddard, Gianna; Bisagni, Paul; Miller, Stacy Boe; Croce, Libby; Downum, Ryan; Evorn, Alexis; Johnson, Savannah; Kreycik, Erin; Martin, Cameron; Montgomery, Afton; Poe, Jessica; Barnes, Kim; Forche, Carolyn; Johnson, Charles; Lee, Li-Young; Nelson, Antonya; Sanchez, Sonia; Wrigley, Robert","Fugue Editors; Barnes, Kim; Baumann, Ruth; Branin, Emma; Butts, Joshua; Chavatel, Caroline; Chodosh, Lydia; Cohen, Julia; Cooper, Sean; Cutter, Weston; Edelman, Adam; Ketner, Trevor; Lee, Whitney; Morel, Jeanne; Moyce, Audrey; Myers, Leah; Piersol, Sabrina; Trabold, Erica; Turowski, Anamyn; Wade, Julie Marie; Wilder, Kathryn; Wolfe-Frischman, Isabel; Wright, Rain; Zeller, Maya Jewel",61,2021,poetry,"Fugue Literary Journal, University of Idaho Department of English, ISSN 1054-6014, https://fuguejournal.com/",Fugue61.pdf,Text,application/pdf,"In Copyright - Educational Use Permitted. For more information, please contact Fugue Literary Journal, https://fuguejournal.com/",http://rightsstatements.org/vocab/InC-EDU/1.0/,eng,,,,pdf,fugue-2021-n61.pdf,https://objects.lib.uidaho.edu/fugue/fugue-2021-n61.pdf,https://objects.lib.uidaho.edu/fugue/small/fugue-2021-n61_sm.jpg,https://objects.lib.uidaho.edu/fugue/thumbs/fugue-2021-n61_th.jpg
fugue-2022-n62,Fugue 62 (2022),"Fitch, Joely; Montgomery, Afton; Croce, Libby; Sirois, Steff; McGriff, Michael; Stoddard, Gianna; Bennett, North; Cox, Crystal; Lurie, Daniel; Carruth, Amanda; Couch, Dylan; Freymiller, Laur; Harper, Michael; Miller, Morgan; Neal, Emma; Rutherford, Dailynn; Siegel, Dylan; Terry, Kade; Bollinger, Carter; Kinkade, Natalie; Marlens, Isabel; Martin, Cameron; Bisagni, Paul; Katseanes, Faith; Kreycik, Erin; Wigen, Kassidy","Borruso, Anthony; Clare, Edith Lidia; Dalrymple, Kiley; Flynn-Goodlett, Luiza; Gleason, Jonathan; Hall, Melissa Darcey; Hill, Tennessee; Larson, Amanda; Lawson, Emily; Maglio, Alice; Merouani, Mathilde; Morris, Matthew; Pyle, Rebecca; Steen, Hanne; Taylor, Mike; Tombasco, Natalie Louise; Tuckner, Matthew; Weeks, Adam D.; Westhoff, Kami; Zeller, Corey; Zoccola, Maria",62,2022,poetry,"Fugue Literary Journal, University of Idaho Department of English, ISSN 1054-6014, https://fuguejournal.com/",Fugue62.pdf,Text,application/pdf,"In Copyright - Educational Use Permitted. For more information, please contact Fugue Literary Journal, https://fuguejournal.com/",http://rightsstatements.org/vocab/InC-EDU/1.0/,eng,,,,pdf,fugue-2022-n62.pdf,https://objects.lib.uidaho.edu/fugue/fugue-2022-n62.pdf,https://objects.lib.uidaho.edu/fugue/small/fugue-2022-n62_sm.jpg,https://objects.lib.uidaho.edu/fugue/thumbs/fugue-2022-n62_th.jpg
fugue-2015-n48,Fugue 48 (2015),"Durham, Jordan; Mastaler, Jason; Landreth, Michael; Brown, Nathaniel; Johnson, Katherine; Pearson, Jeff; Barnes, Kim; Johnson, Charles; Nelson, Antonya; Wrigley, Robert; Forche, Carolyn; Lee, Li-Young; Sanchez, Sonia; Bond, Corrin; Burtis, Chantilly; Clapper, Jordan; Hargreaves, Ross; Maynard, Seth; Newman, Erika; Rogers, Clair; Sullivan, Ian; Whitt, David; Bright, Ashleigh; Cushing, Michelle; Gehrke, Meghan; Hensley, Cherise; McCabe, Justin; Perreault, Joseph; Sarna, Jason; Utermohlen, Karl; Yazwinski, Sally; Culton, Lane; Hites, Caitlin; Goedker, Ashley; Jarboe, Canese; Teague, Alexandra","Bridger, Kierstin; Balma, Kathleen; Barngrover, Anne; Kindig, Patrick; Davis, Nicelle; Piller, Erick; Sofala, Hali Fuailelagi; Cole, Emily Rose; Wong, Ashley; Wagenaar, Chelsea; Hunt, Kathryn; Ernst, Cody; Hull, M. Ann; Capra-Thomas, Caylin; Smith, Rob McClure; Hall, J.H.; Kline, Mark; Ponepinto, Joe; Evison, Jonathan; O'Riordan, Valerie; Evison, Jonathan",48,2015,poetry,"Fugue Literary Journal, University of Idaho Department of English, ISSN 1054-6014, https://fuguejournal.com/",FugueIssue48_2015.pdf,Text,application/pdf,"In Copyright - Educational Use Permitted. For more information, please contact Fugue Literary Journal, https://fuguejournal.com/",http://rightsstatements.org/vocab/InC-EDU/1.0/,eng,,,,pdf,fugue-2015-n48.pdf,https://objects.lib.uidaho.edu/fugue/fugue-2015-n48.pdf,https://objects.lib.uidaho.edu/fugue/small/fugue-2015-n48_sm.jpg,https://objects.lib.uidaho.edu/fugue/thumbs/fugue-2015-n48_th.jpg
fugue-2012-n42,Fugue 42 (2012),"Bromley-Vogel, Warren; Colton, M. Chase; Ross, Amy; Ritcher, Jamaica; Pizzo, Laura; Barnes, Kim; Johnson, Charles; Nelson, Antonya; Wrigley, Robert; Forche, Carolyn; Lee, Li-Young; Sanchez, Sonia; Benedict, Michael; Brown, Jessica; Cross, Kasondra; Hendricks, Sara; Mansour, Saleeha; Newton, Shea; Severn, Eric; Thompson, Tasha; Borges, Karina; Christiansen, Summer; Dutcher, Esme; Kammers, Bryce; Maw, Matt; Poor, Aaron; Stoddard, Cara; Whitcomb, Amy; Akin, Jeremiah; Fernandez, Joel; Paulsen, Ferrol; Sappington, David; Day, Sandi; Greenwell, Eric; Sandford, Jonah; Silva, Wendy; Ropski, Beth; McFarland, Ronald","Jackson, Gary; Vap, Sarah; Adamshick, Carl; Mackenzie, Caitlin; Somers, Max; Boss, Todd; Fontaine, Tessa; Braver, Blair; McDuffie, Anne; Purpura, Lia; Unikel, Joshua; Johnson, Lindsey; Ray, Shann; Pizzo, Laura; Ritcher, Jamaica",42,2012,poetry,"Fugue Literary Journal, University of Idaho Department of English, ISSN 1054-6014, https://fuguejournal.com/",fugue_42.pdf,Text,application/pdf,"In Copyright - Educational Use Permitted. For more information, please contact Fugue Literary Journal, https://fuguejournal.com/",http://rightsstatements.org/vocab/InC-EDU/1.0/,eng,,,,pdf,fugue-2012-n42.pdf,https://objects.lib.uidaho.edu/fugue/fugue-2012-n42.pdf,https://objects.lib.uidaho.edu/fugue/small/fugue-2012-n42_sm.jpg,https://objects.lib.uidaho.edu/fugue/thumbs/fugue-2012-n42_th.jpg
fugue-2016-n50,Fugue 50 (2016),"Durham, Jordan; Jarboe, Canese; Brown, Nathaniel; McDermott, Jessica; Goedker, Ashley; Barnes, Kim; Johnson, Charles; Nelson, Antonya; Wrigley, Robert; Forche, Carolyn; Lee, Li-Young; Sanchez, Sonia; Caraway, Mary; Hargreaves, Ross; Jeske, Autry; Nanney, Clifton; Perreault, Joseph; Roglin, Gabrielle; Stephenson, Calvin; Utermohlen, Karl; Westerfield, Lauren; Clapper, Jordan; Hull, Madison; Kersten, Courtney; Meyer, Will; Orona, Rosemarie; Pickens, Breanne; Soumas, Michelle; Stokes, Katherine; Westby, Rachel; Whitt, David; Culton, Lane; Fraley, Samantha; McGill, Cameron; Rosgen, Michael; Fisher, Morgan; Lewis, Katherine; Robson, Justin; Scott, Cassie; Teague, Alexandra","Yun, J.H.; Whalen, Jennifer; Prince, Katie; Lewis, Paige; Lemon, Alex; Onusko, Elizabeth; McCabe, Nancy; McDannald, David; Kirkman, Isaac; Stevens, Jon Vanzant",50,2016,poetry,"Fugue Literary Journal, University of Idaho Department of English, ISSN 1054-6014, https://fuguejournal.com/",fugue_50_2016.pdf,Text,application/pdf,"In Copyright - Educational Use Permitted. For more information, please contact Fugue Literary Journal, https://fuguejournal.com/",http://rightsstatements.org/vocab/InC-EDU/1.0/,eng,,,,pdf,fugue-2016-n50.pdf,https://objects.lib.uidaho.edu/fugue/fugue-2016-n50.pdf,https://objects.lib.uidaho.edu/fugue/small/fugue-2016-n50_sm.jpg,https://objects.lib.uidaho.edu/fugue/thumbs/fugue-2016-n50_th.jpg