objectid,title,title_alt,date,creator,description,subject,category,site,period_of_record,frequency,source,type,format,rights,rightsstatement,original_url,filename,display_template,object_location,image_small,image_thumb,notes
ng_pub_080,Fine roots of trees – a new perspecitve,,2002,"Pregitzer, K.S.",,,Article,,,,"New Phytologist, Volume 154, Issue 2, May 2002, https://doi.org/10.1046/j.1469-8137.2002.00413_1.x",Text,,,,https://webpages.uidaho.edu/nitrogen-gradient/Publications/Pregitzer_2002_New_Phytologist.pdf,pregitzer_2002_new_phytologist.pdf,record,https://doi.org/10.1046/j.1469-8137.2002.00413_1.x,https://objects.lib.uidaho.edu/nitrogen-gradient/small/pregitzer_2002_new_phytologist_sm.jpg,https://objects.lib.uidaho.edu/nitrogen-gradient/thumbs/pregitzer_2002_new_phytologist_th.jpg,"PDF was shared on original site, but unable to determine rights status, so currently changed to record only item."
ng_pub_082,The effects of long-term nitrogen deposition on extracellular enzyme activity in an <i>Acer saccharum </i>forest soil,,2002,"Saiya-Cork, K.",,,M.S. Thesis,,,,"M.S. Thesis, University of Toledo",Text,,,,,,record,,,,
ng_pub_083,The effects of long-term nitrogen deposition on extracellular enzyme activity in an <i>Acer saccharum</i> forest soil,,2002,"Saiya-Cork, K. R., R. L. Sinsabaugh, and D. R. Zak",,,Article,,,,"Soil Biology and Biochemistry, Volume 34, Issue 9, September 2002, https://doi.org/10.1016/S0038-0717(02)00074-3",Text,,,,https://webpages.uidaho.edu/nitrogen-gradient/Publications/Saiya_Cork_2002_Soil_Biology_and_Biochemistry.pdf,saiya_cork_2002_soil_biology_and_biochemistry.pdf,record,https://doi.org/10.1016/S0038-0717(02)00074-3,https://objects.lib.uidaho.edu/nitrogen-gradient/small/saiya_cork_2002_soil_biology_and_biochemistry_sm.jpg,https://objects.lib.uidaho.edu/nitrogen-gradient/thumbs/saiya_cork_2002_soil_biology_and_biochemistry_th.jpg,"PDF was shared on original site, but unable to determine rights status, so currently changed to record only item."
ng_pub_084,Predicting daily mean soil temperature from daily mean air temperature in four northern hardwood forest stands,,2000,"Brown, S.E., K.S. Pregitzer, D.D. Reed, and A.J. Burton",,,Article,,,,"Forest Science, Volume 46, Issue 2, May 2000, https://doi.org/10.1093/forestscience/46.2.297",Text,,,,https://webpages.uidaho.edu/nitrogen-gradient/Publications/Brown_et_al_2000_Forest_Science.pdf,brown_et_al_2000_forest_science.pdf,record,https://doi.org/10.1093/forestscience/46.2.297,https://objects.lib.uidaho.edu/nitrogen-gradient/small/brown_et_al_2000_forest_science_sm.jpg,https://objects.lib.uidaho.edu/nitrogen-gradient/thumbs/brown_et_al_2000_forest_science_th.jpg,"PDF was shared on original site, but unable to determine rights status, so currently changed to record only item."
ng_pub_085,Relationships between fine root dynamics and nitrogen availability in Michigan northern hardwood forests,,2000,"Burton, A.J., K.S. Pregitzer, and R.L. Hendrick",,,Article,,,,"Oecologia, Volume 125, November 2000, https://doi.org/10.1007/s004420000455",Text,,,,https://webpages.uidaho.edu/nitrogen-gradient/Publications/Burton_2000_Oecologia.pdf,burton_2000_oecologia.pdf,record,https://doi.org/10.1007/s004420000455,https://objects.lib.uidaho.edu/nitrogen-gradient/small/burton_2000_oecologia_sm.jpg,https://objects.lib.uidaho.edu/nitrogen-gradient/thumbs/burton_2000_oecologia_th.jpg,"PDF was shared on original site, but unable to determine rights status, so currently changed to record only item."
ng_pub_086,Responses of tree fine roots to temperature,,2000,"Pregitzer, K.S., J.S. King, A.J. Burton, and S.E. Brown",,,Article,,,,"New Phytologist, Volume 147, Issue 1, July 2000, https://doi.org/10.1046/j.1469-8137.2000.00689.x",Text,,,,https://webpages.uidaho.edu/nitrogen-gradient/Publications/Pregitzer_2000_New_Phytol.pdf,pregitzer_2000_new_phytol.pdf,record,https://doi.org/10.1046/j.1469-8137.2000.00689.x,https://objects.lib.uidaho.edu/nitrogen-gradient/small/pregitzer_2000_new_phytol_sm.jpg,https://objects.lib.uidaho.edu/nitrogen-gradient/thumbs/pregitzer_2000_new_phytol_th.jpg,"PDF was shared on original site, but unable to determine rights status, so currently changed to record only item."
ng_pub_087,The kinetics of nitrogen uptake by <i>Populus tremuloides</i> grown under experimental atmospheric CO<sub>2</sub> and soil N availability treatments,,2000,"Rothstein, D.E., D.R. Zak, K.S. Pregitzer, and P.S. Curtis",,,Article,,,,"Tree Physiology, Volume 20, Issue 4, March 2000, https://doi.org/10.1093/treephys/20.4.265",Text,,,,https://webpages.uidaho.edu/nitrogen-gradient/Publications/Rothstein_2000_Tree_Phys.pdf,rothstein_2000_tree_phys.pdf,record,https://doi.org/10.1093/treephys/20.4.265,https://objects.lib.uidaho.edu/nitrogen-gradient/small/rothstein_2000_tree_phys_sm.jpg,https://objects.lib.uidaho.edu/nitrogen-gradient/thumbs/rothstein_2000_tree_phys_th.jpg,"PDF was shared on original site, but unable to determine rights status, so currently changed to record only item."
ng_pub_088,Microbial immobilization and the retention of anthropogenic nitrate in a northern hardwood forest,,2000,"Zogg, G.P., D.R. Zak, K.S. Pregitzer, and A.J. Burton",,,Article,,,,"Ecology, Volume 81, Issue 7, July 2000, https://doi.org/10.1890/0012-9658(2000)081[1858:MIATRO]2.0.CO;2",Text,,,,https://webpages.uidaho.edu/nitrogen-gradient/Publications/Zogg_2000_Ecology.pdf,zogg_2000_ecology.pdf,record,https://doi.org/10.1890/0012-9658(2000)081[1858:MIATRO]2.0.CO;2,https://objects.lib.uidaho.edu/nitrogen-gradient/small/zogg_2000_ecology_sm.jpg,https://objects.lib.uidaho.edu/nitrogen-gradient/thumbs/zogg_2000_ecology_th.jpg,"PDF was shared on original site, but unable to determine rights status, so currently changed to record only item."
ng_pub_089,Production dynamics and climate in four northern hardwood stands in Michigan,,1999,"Brown, S.E.",,,Ph.D. Dissertation,,,,"Ph.D. Dissertation, Michigan Technological University, Houghton",Text,application/pdf,,,https://webpages.uidaho.edu/nitrogen-gradient/Publications/Brown_dissertation_1999.pdf,brown_dissertation_1999.pdf,pdf,https://objects.lib.uidaho.edu/nitrogen-gradient/brown_dissertation_1999.pdf,https://objects.lib.uidaho.edu/nitrogen-gradient/small/brown_dissertation_1999_sm.jpg,https://objects.lib.uidaho.edu/nitrogen-gradient/thumbs/brown_dissertation_1999_th.jpg,
ng_pub_090,Soil warming and carbon loss from a Lake States spodosol,,1999,"MacDonald, N.W., D.L. Randlett, and D.R. Zak",,,Article,,,,"Soil Science Society of America Journal, Volume 63, Issue 1, https://doi.org/10.2136/sssaj1999.03615995006300010030x",Text,,,,https://webpages.uidaho.edu/nitrogen-gradient/Publications/MacDonald 1999 SSSAJ.pdf,macdonald_1999_sssaj.pdf,record,https://doi.org/10.2136/sssaj1999.03615995006300010030x,https://objects.lib.uidaho.edu/nitrogen-gradient/small/macdonald_1999_sssaj_sm.jpg,https://objects.lib.uidaho.edu/nitrogen-gradient/thumbs/macdonald_1999_sssaj_th.jpg,"PDF was shared on original site, but unable to determine rights status, so currently changed to record only item."
ng_pub_091,"Ecophysiology of three deciduous forest herbs: Relationships between physiology, life history and ecosystem-level nitrogen cycling",,1999,"Rothstein, D.E.",,,Ph.D. Dissertation,,,,"Ph.D. Dissertation, University of Michigan, Ann Arbor",Text,,,,,,record,https://hdl.handle.net/2027.42/131988,,,
ng_pub_092,"Soil temperature, matric potential, and the kinetics of microbial respiration and net N mineralization",,1999,"Zak, D.R., W.E. Holmes, N.W. MacDonald, and K.S. Pregitzer",,,Article,,,,"Soil Science Society of America Journal, Volume 63, Issue 3, May-June 1999, https://doi.org/10.2136/sssaj1999.03615995006300030021x",Text,,,,https://webpages.uidaho.edu/nitrogen-gradient/Publications/Zak_1999_SSSAJ.pdf,zak_1999_sssaj.pdf,record,https://doi.org/10.2136/sssaj1999.03615995006300030021x,https://objects.lib.uidaho.edu/nitrogen-gradient/small/zak_1999_sssaj_sm.jpg,https://objects.lib.uidaho.edu/nitrogen-gradient/thumbs/zak_1999_sssaj_th.jpg,"PDF was shared on original site, but unable to determine rights status, so currently changed to record only item."
ng_pub_093,Drought reduces root respiration in sugar maple forests,,1998,"Burton, A.J., K.S. Pregitzer, G.P. Zogg, and D.R. Zak",,,Article,,,,"Ecological Applications Volume 8, Issue 3, August 1998, https://doi.org/10.1890/1051-0761(1998)008[0771:DRRRIS]2.0.CO;2",Text,,,,https://webpages.uidaho.edu/nitrogen-gradient/Publications/Burton_1998_Ecological_Applications.pdf,burton_1998_ecological_applications.pdf,record,https://doi.org/10.1890/1051-0761(1998)008[0771:DRRRIS]2.0.CO;2,https://objects.lib.uidaho.edu/nitrogen-gradient/small/burton_1998_ecological_applications_sm.jpg,https://objects.lib.uidaho.edu/nitrogen-gradient/thumbs/burton_1998_ecological_applications_th.jpg,"PDF was shared on original site, but unable to determine rights status, so currently changed to record only item."
ng_pub_094,"Environmental stress effects on vigor, mortality, and growth in northern hardwood forests along a pollution-climate gradient",,1998,"MacDonald, N.W., J.A. Witter, D.D. Reed, A.J. Burton, K.S. Pregitzer, and H.O. Liechty",,,Article,,,,Michigan Academician,Text,,,,,,record,,,,
ng_pub_095,Variation in sugar maple root respiration with root diameter and soil depth,,1998,"Pregitzer, K.S., M.J. Laskowski, A.J. Burton, V.C. Lessard, and D.R. Zak",,,Article,,,,"Tree Physiology, Volume 18, Issue 10, October 1998, https://doi.org/10.1093/treephys/18.10.665",Text,,,,https://webpages.uidaho.edu/nitrogen-gradient/Publications/Pregitzer_1998_Tree_Physiol.pdf,pregitzer_1998_tree_physiol.pdf,record,https://doi.org/10.1093/treephys/18.10.665,https://objects.lib.uidaho.edu/nitrogen-gradient/small/pregitzer_1998_tree_physiol_sm.jpg,https://objects.lib.uidaho.edu/nitrogen-gradient/thumbs/pregitzer_1998_tree_physiol_th.jpg,"PDF was shared on original site, but unable to determine rights status, so currently changed to record only item."
ng_pub_096,Integration of ecophysiological and biogeochemical approaches to ecosystem dynamics,,1998,"Zak, D.R., and K.S. Pregitzer",,,Article,,,,"Successes, Limitations, and Frontiers in Ecosystem Science",Text,,,,,,record,,,,
ng_pub_097,Sugar maple fine root respiration and longevity along a latitudinal gradient,,1997,"Burton, A.J.",,,Ph.D. Dissertation,,,,"Ph.D. Dissertation, Michigan Technological University, Houghton",Text,application/pdf,,,https://webpages.uidaho.edu/nitrogen-gradient/Publications/Burton_dissertation_1997.pdf,burton_dissertation_1997.pdf,pdf,https://objects.lib.uidaho.edu/nitrogen-gradient/burton_dissertation_1997.pdf,https://objects.lib.uidaho.edu/nitrogen-gradient/small/burton_dissertation_1997_sm.jpg,https://objects.lib.uidaho.edu/nitrogen-gradient/thumbs/burton_dissertation_1997_th.jpg,
ng_pub_098,Effects of measurement CO<sub>2</sub> concentration on sugar maple root respiration,,1997,"Burton, A.J., G.P. Zogg, K.S. Pregitzer, and D.R. Zak",,,Article,,,,"Tree Physiology, Volume 17, Issue 7, July 1997, https://doi.org/10.1093/treephys/17.7.421",Text,,,,https://webpages.uidaho.edu/nitrogen-gradient/Publications/Burton_1997_Tree_phys.pdf,burton_1997_tree_phys.pdf,record,https://doi.org/10.1093/treephys/17.7.421,https://objects.lib.uidaho.edu/nitrogen-gradient/small/burton_1997_tree_phys_sm.jpg,https://objects.lib.uidaho.edu/nitrogen-gradient/thumbs/burton_1997_tree_phys_th.jpg,"PDF was shared on original site, but unable to determine rights status, so currently changed to record only item."
ng_pub_099,The relationship between fine root demography and the soil environment in northern hardwood forests,,1997,"Hendrick, R.L. and K.S. Pregitzer",,,Article,,,,"Ecoscience, Volume 4, Issue 1, August 1996, https://doi.org/10.1080/11956860.1997.11682383",Text,,,,https://webpages.uidaho.edu/nitrogen-gradient/Publications/Hendrick_1997_EcoScience.pdf,hendrick_1997_ecoscience.pdf,record,https://doi.org/10.1080/11956860.1997.11682383,https://objects.lib.uidaho.edu/nitrogen-gradient/small/hendrick_1997_ecoscience_sm.jpg,https://objects.lib.uidaho.edu/nitrogen-gradient/thumbs/hendrick_1997_ecoscience_th.jpg,"PDF was shared on original site, but unable to determine rights status, so currently changed to record only item."
ng_pub_100,"Relationships among root branch order, carbon, and nitrogen in four temperate species",,1997,"Pregitzer, K.S., M.E. Kubiske, C.K. Yu, and R.L. Hendrick",,,Article,,,,"Oecologia, Volume 111, July 1997, https://doi.org/10.1007/s004420050239",Text,,,,https://webpages.uidaho.edu/nitrogen-gradient/Publications/Pregitzer_97_Oecologia.pdf,pregitzer_97_oecologia.pdf,record,https://doi.org/10.1007/s004420050239,https://objects.lib.uidaho.edu/nitrogen-gradient/small/pregitzer_97_oecologia_sm.jpg,https://objects.lib.uidaho.edu/nitrogen-gradient/thumbs/pregitzer_97_oecologia_th.jpg,"PDF was shared on original site, but unable to determine rights status, so currently changed to record only item."
ng_pub_101,Compositional and functional shifts in microbial communities related to soil warming,,1997,"Zogg, G.P., D.R. Zak, D.B. Ringelberg, N.W. MacDonald, K.S. Pregitzer, and D.C. White",,,Article,,,,"Michigan Nitrogen Deposition Gradient Study, University of Idaho",Text,application/pdf,,,https://webpages.uidaho.edu/nitrogen-gradient/Publications/Zogg_1997_SSSAJ.pdf,zogg_1997_sssaj.pdf,pdf,https://doi.org/10.1007/s004420050239,https://objects.lib.uidaho.edu/nitrogen-gradient/small/zogg_1997_sssaj_sm.jpg,https://objects.lib.uidaho.edu/nitrogen-gradient/thumbs/zogg_1997_sssaj_th.jpg,
ng_pub_102,Belowground carbon dynamics in northern hardwood forests: Factors controlling respiration from roots and soil microorganisms,,1997,"Zogg, G.P.",,,Ph.D. Dissertation,,,,"Ph.D. Dissertation, University of Michigan, Ann Arbor",Text,,,,,,record,https://hdl.handle.net/2027.42/130405,,,
ng_pub_103,Latitudinal variation in sugar maple fine root respiration,,1996,"Burton, A.J., K.S. Pregitzer, G.P. Zogg, and D.R. Zak",,,Article,,,,"Canadian Journal of Forest Research, Volume 26, Numer 10, October 1996, https://doi.org/10.1139/x26-200",Text,,,,https://webpages.uidaho.edu/nitrogen-gradient/Publications/Burton_1996_CJFR.pdf,burton_1996_cjfr.pdf,record,https://doi.org/10.1139/x26-200,https://objects.lib.uidaho.edu/nitrogen-gradient/small/burton_1996_cjfr_sm.jpg,https://objects.lib.uidaho.edu/nitrogen-gradient/thumbs/burton_1996_cjfr_th.jpg,"PDF was shared on original site, but unable to determine rights status, so currently changed to record only item."
ng_pub_104,Temporal and depth-related patterns of fine root dynamics in northern hardwood forests,,1996,"Hendrick, R.L. and K.S. Pregitzer",,,Article,,,,"Journal of Ecology, Volume 84, No. 2, April 1996, https://doi.org/10.2307/2261352",Text,,,,https://webpages.uidaho.edu/nitrogen-gradient/Publications/Hendrick_1996_Ecology.pdf,hendrick_1996_ecology.pdf,record,https://doi.org/10.2307/2261352,https://objects.lib.uidaho.edu/nitrogen-gradient/small/hendrick_1996_ecology_sm.jpg,https://objects.lib.uidaho.edu/nitrogen-gradient/thumbs/hendrick_1996_ecology_th.jpg,"PDF was shared on original site, but unable to determine rights status, so currently changed to record only item."
ng_pub_105,Applications of minirhizotrons to understand root function in forests and other natural ecosystems,,1996,"Hendrick, R.L. and K.S. Pregitzer",,,Article,,,,"Plant Soil, Volume 185, September 1996, https://doi.org/10.1007/BF02257535",Text,,,,https://webpages.uidaho.edu/nitrogen-gradient/Publications/Hendrick_1996_Plant_Soil.pdf,hendrick_1996_plant_soil.pdf,record,https://doi.org/10.1007/BF02257535,https://objects.lib.uidaho.edu/nitrogen-gradient/small/hendrick_1996_plant_soil_sm.jpg,https://objects.lib.uidaho.edu/nitrogen-gradient/thumbs/hendrick_1996_plant_soil_th.jpg,"PDF was shared on original site, but unable to determine rights status, so currently changed to record only item."
ng_pub_106,Relationships between soluble sugar concentrations in roots and ecosystem stress for the first-year sugar maple seedlings,,1996,"McLaughlin, J.W., S.T. Bagley, D.D. Reed, M.F. Jurgensen, and G.D. Mroz",,,Article,,,,"Water, Air, and Soil Pollution, Volume 88, March 1996, https://doi.org/10.1007/BF00157410",Text,,,,https://webpages.uidaho.edu/nitrogen-gradient/Publications/McLaughlin_1996_Water_Air_and_Soil_Pollution.pdf,mclaughlin_1996_water_air_and_soil_pollution.pdf,record,https://doi.org/10.1007/BF00157410,https://objects.lib.uidaho.edu/nitrogen-gradient/small/mclaughlin_1996_water_air_and_soil_pollution_sm.jpg,https://objects.lib.uidaho.edu/nitrogen-gradient/thumbs/mclaughlin_1996_water_air_and_soil_pollution_th.jpg,"PDF was shared on original site, but unable to determine rights status, so currently changed to record only item."
ng_pub_107,Nitrate deposition in northern hardwood forests and the N metabolism of <i>Acer saccharum</i>,,1996,"Rothstein, D.E., D.R. Zak, and K.S. Pregitzer",,,Article,,,,"Oecologia, Volume 108, October 1996, https://doi.org/10.1007/BF00334659",Text,,,,https://webpages.uidaho.edu/nitrogen-gradient/Publications/Rothstein_96_Oecologia.pdf,rothstein_96_oecologia.pdf,record,https://doi.org/10.1007/BF00334659,https://objects.lib.uidaho.edu/nitrogen-gradient/small/rothstein_96_oecologia_sm.jpg,https://objects.lib.uidaho.edu/nitrogen-gradient/thumbs/rothstein_96_oecologia_th.jpg,"PDF was shared on original site, but unable to determine rights status, so currently changed to record only item."
ng_pub_108,Fine root respiration in northern hardwood forests in relation to temperature and nitrogen availability,,1996,"Zogg, G.P., D.R. Zak, and A.J. Burton, and K.S. Pregitzer",,,Article,,,,"Tree Physiology, Volume 16, Issue 8, August 1996, https://doi.org/10.1093/treephys/16.8.719",Text,,,,https://webpages.uidaho.edu/nitrogen-gradient/Publications/Zogg_1996_Tree_Physiol.pdf,zogg_1996_tree_physiol.pdf,record,https://doi.org/10.1093/treephys/16.8.719,https://objects.lib.uidaho.edu/nitrogen-gradient/small/zogg_1996_tree_physiol_sm.jpg,https://objects.lib.uidaho.edu/nitrogen-gradient/thumbs/zogg_1996_tree_physiol_th.jpg,"PDF was shared on original site, but unable to determine rights status, so currently changed to record only item."
ng_pub_109,Nitrate saturation in northern hardwood forests: potential for nitrate leaching,,1995,"Govindarajulu, U.",,,M.S. Thesis,,,,"M.S. Thesis, University of Michigan, Ann Arbor",Text,,,,,,record,https://hdl.handle.net/2027.42/106278,,,
ng_pub_110,Dissolved organic carbon in northern hardwood stands with differing acidic inputs and temperature regimes,,1995,"Liechty, H.O., E. Kuuseoks, and G.D. Mroz",,,Article,,,,"Journal of Environmental Quality, Volume 24, Issue 5, September-October 1995, https://doi.org/10.2134/jeq1995.00472425002400050021x",Text,,,,https://webpages.uidaho.edu/nitrogen-gradient/Publications/Liechty_1995_JEQ.pdf,liechty_1995_jeq.pdf,record,https://doi.org/10.2134/jeq1995.00472425002400050021x,https://objects.lib.uidaho.edu/nitrogen-gradient/small/liechty_1995_jeq_sm.jpg,https://objects.lib.uidaho.edu/nitrogen-gradient/thumbs/liechty_1995_jeq_th.jpg,"PDF was shared on original site, but unable to determine rights status, so currently changed to record only item."
ng_pub_111,Temperature effects on kinetics of microbial respiration and net nitrogen and sulfur mineralization,,1995,"MacDonald, N.W., D.R. Zak, and K.S. Pregitzer",,,Article,,,,"Soil Science Society of America Journal, Volume 59, Issue 1, January-February 1995, https://doi.org/10.2136/sssaj1995.03615995005900010036x",Text,,,,https://webpages.uidaho.edu/nitrogen-gradient/Publications/MacDonald_1995_SSSAJ.pdf,macdonald_1995_sssaj.pdf,record,https://doi.org/10.2136/sssaj1995.03615995005900010036x,https://objects.lib.uidaho.edu/nitrogen-gradient/small/macdonald_1995_sssaj_sm.jpg,https://objects.lib.uidaho.edu/nitrogen-gradient/thumbs/macdonald_1995_sssaj_th.jpg,"PDF was shared on original site, but unable to determine rights status, so currently changed to record only item."
ng_pub_112,Nitrate deposition in northern hardwood forests and the N metabolism of <i>Acer saccharum</i> Marsh,,1995,"Rothstein, D.E.",,,M.S. Thesis,,,,"M.S. Thesis, University of Michigan, Ann Arbor",Text,,,,,,record,https://hdl.handle.net/2027.42/114225,,,
ng_pub_113,Ecological implications of projected climate change scenarios in forest ecosystems of central North America,,1994,"Jones, E.A., D.D. Reed, and P.V. Desanker",,,Article,,,,"Agricultural and Forest Meteorology, Volume 72, Issues 1-2, December 1994, https://doi.org/10.1016/0168-1923(94)90089-2",Text,,,,https://webpages.uidaho.edu/nitrogen-gradient/Publications/Jones_1994_Agric_For_Metogy.pdf,jones_1994_agric_for_metogy.pdf,record,https://doi.org/10.1016/0168-1923(94)90089-2,https://objects.lib.uidaho.edu/nitrogen-gradient/small/jones_1994_agric_for_metogy_sm.jpg,https://objects.lib.uidaho.edu/nitrogen-gradient/thumbs/jones_1994_agric_for_metogy_th.jpg,"PDF was shared on original site, but unable to determine rights status, so currently changed to record only item."
ng_pub_114,Evaluation of climate and forest growth models in Michigan,,1994,"Kuuseoks, E.",,,M.S. Thesis,,,,"M.S. Thesis, Michigan Technological University, Houghton",Text,,,,,,record,,,,
ng_pub_115,An evaluation of throughfall chemistry in northern hardwoods along an air pollution gradient.,,1994,"Liechty, H.O.",,,Ph.D. Dissertation,,,,"Ph.D. Dissertation, Michigan Technological University, Houghton",Text,,,,https://webpages.uidaho.edu/nitrogen-gradient/Publications_Dissertation_Liechty.htm,,record,,,,
ng_pub_116,Sulfate adsorption in forest soils of the Great Lakes region,,1994,"MacDonald, N.W., A.J. Burton, J.A. Witter, and D.D. Richter",,,Article,,,,"Soil Science Societ of America Journal, Volume 58, Issue 5, September - October 1994, https://doi.org/10.2136/sssaj1994.03615995005800050039x",Text,,,,https://webpages.uidaho.edu/nitrogen-gradient/Publications/MacDonald_1994_SSSAJ.pdf,macdonald_1994_sssaj.pdf,record,https://doi.org/10.2136/sssaj1994.03615995005800050039x,https://objects.lib.uidaho.edu/nitrogen-gradient/small/macdonald_1994_sssaj_sm.jpg,https://objects.lib.uidaho.edu/nitrogen-gradient/thumbs/macdonald_1994_sssaj_th.jpg,"PDF was shared on original site, but unable to determine rights status, so currently changed to record only item."
ng_pub_117,Foliar amino acid accumulation as an indicator of ecosystem stress for first-year sugar maple seedlings,,1994,"McLaughlin, J.W., D.D. Reed, S.T. Bagley, M.F. Jurgensen, and G.D. Mroz",,,Article,,,,"Journal of Environmental Quality, Volume 23, Issue 1, January - February 1994, https://doi.org/10.2134/jeq1994.00472425002300010024x",Text,,,,https://webpages.uidaho.edu/nitrogen-gradient/Publications/McLaughlin_1994_JEQ.pdf,mclaughlin_1994_jeq.pdf,record,https://doi.org/10.2134/jeq1994.00472425002300010024x,https://objects.lib.uidaho.edu/nitrogen-gradient/small/mclaughlin_1994_jeq_sm.jpg,https://objects.lib.uidaho.edu/nitrogen-gradient/thumbs/mclaughlin_1994_jeq_th.jpg,"PDF was shared on original site, but unable to determine rights status, so currently changed to record only item."
ng_pub_118,Potential impacts of projected climate change scenarios on individual tree species in central North America,,1994,"Reed, D.D., E.A. Jones, and P.V. Desanker",,,Conference proceedings,,,,"Proceedings of the 13th International Congress of Biometeorology, Part 2, Volume I",Text,,,,,,record,,,,
ng_pub_119,Studying the effects of air pollution on forests along exposure gradients: experiences in the United States and opportunities for cooperation,,1994,"Reed, D.D., G.D. Mroz, H.O. Liechty, K.S. Pregitzer, A.J. Burton, D.R. Zak, J.A. Witter, and N.W. MacDonald",,,Conference proceedings,,,,Proceedings of the Conference on Climate and Atmospheric Deposition Studies in Forests,Text,,,,,,record,,,,
ng_pub_120,Productivity and growth efficiency in sugar maple forests,,1994,"Reed, D.D., K.S. Pregitzer, H.O. Liechty, A.J. Burton, and G.D. Mroz",,,Article,,,,"Forest Ecology and Management, Volume 70, Issues 1-3, December 1994, https://doi.org/10.1016/0378-1127(94)90097-3",Text,,,,https://webpages.uidaho.edu/nitrogen-gradient/Publications/Reed_1994_For_Ecology_Mgnt.pdf,reed_1994_for_ecology_mgnt.pdf,record,https://doi.org/10.1016/0378-1127(94)90097-3,https://objects.lib.uidaho.edu/nitrogen-gradient/small/reed_1994_for_ecology_mgnt_sm.jpg,https://objects.lib.uidaho.edu/nitrogen-gradient/thumbs/reed_1994_for_ecology_mgnt_th.jpg,"PDF was shared on original site, but unable to determine rights status, so currently changed to record only item."
ng_pub_121,Foliar nutrients in sugar maple forests along a regional pollution-climate gradient,,1993,"Burton, A.J., K.S. Pregitzer, and N.W. MacDonald",,,Article,,,,"Soil Science Society of America Journal, Volume 57, Issue 6, November - December 1993, https://doi.org/10.2136/sssaj1993.03615995005700060036x",Text,,,,https://webpages.uidaho.edu/nitrogen-gradient/Publications/Burton_1993_SSSAJ.pdf,burton_1993_sssaj.pdf,record,https://doi.org/10.2136/sssaj1993.03615995005700060036x,https://objects.lib.uidaho.edu/nitrogen-gradient/small/burton_1993_sssaj_sm.jpg,https://objects.lib.uidaho.edu/nitrogen-gradient/thumbs/burton_1993_sssaj_th.jpg,"PDF was shared on original site, but unable to determine rights status, so currently changed to record only item."
