objectid,title,title_alt,date,creator,description,subject,category,site,period_of_record,frequency,source,type,format,rights,rightsstatement,original_url,filename,display_template,object_location,image_small,image_thumb,notes
ng_pub_010,Redefining fine roots improves understanding of below-ground contributions to terrestrial biosphere processes,,2015,"M. Luke McCormack, Ian A. Dickie, David M. Eissenstat, Timothy J. Fahey, Christopher W. Fernandez, Dali Guo, Helj€a-Sisko Helmisaari, Erik A. Hobbie, Colleen M. Iversen, Robert B. Jackson, Jaana Leppalammi-Kujansuu, Richard J. Norby, Richard P. Phillips, Kurt S. Pregitzer, Seth G. Pritchard, Boris Rewald and Marcin Zadworny",,,Article,,,,"New Phytologist, Volume 207, Issue 3, March 2015, DOI:10.1111/nph.13363",Text,,,,https://webpages.uidaho.edu/nitrogen-gradient/Publications/McCormack_et_al-2015-New_Phytologist.pdf,mccormack_et_al-2015-new_phytologist.pdf,record,https://doi.org/10.1111/nph.13363,https://objects.lib.uidaho.edu/nitrogen-gradient/small/mccormack_et_al-2015-new_phytologist_sm.jpg,https://objects.lib.uidaho.edu/nitrogen-gradient/thumbs/mccormack_et_al-2015-new_phytologist_th.jpg,"PDF was shared on original site, but unable to determine rights status, so currently changed to record only item."
ng_pub_011,Fine roots are the dominant source of recalcitrant plant litter in sugar maple-dominated northern hardwood forests,,2015,"Xia, M., A.F. Talhelm, and K.S. Pregitzer",,,Article,,,,"New Phytologist, Volume 208, Issue 3, June 2015, doi: 10.1111/nph.13494",Text,,,,https://webpages.uidaho.edu/nitrogen-gradient/Publications/Xia-et-al-2015-Gradient-litter-chem.pdf,xia-et-al-2015-gradient-litter-chem.pdf,record,https://doi.org/10.1111/nph.13494,https://objects.lib.uidaho.edu/nitrogen-gradient/small/xia-et-al-2015-gradient-litter-chem_sm.jpg,https://objects.lib.uidaho.edu/nitrogen-gradient/thumbs/xia-et-al-2015-gradient-litter-chem_th.jpg,"PDF was shared on original site, but unable to determine rights status, so currently changed to record only item."
ng_pub_012,"Atmospheric N Deposition Alters Connectance, but not Functional Potential Among Saprotrophic Bacterial Communities",,2015,"Freedman, Z., and D.R. Zak",,,Article,,,,"Molecular Ecology, Volume 24, Issue 12, May 2015, DOI:10.1111/mec.13224",Text,,,,https://webpages.uidaho.edu/nitrogen-gradient/Publications/Freedman_2015_Mol_Ecol_Accepted.pdf,freedman_2015_mol_ecol_accepted.pdf,record,https://doi.org/10.1111/mec.13224,https://objects.lib.uidaho.edu/nitrogen-gradient/small/freedman_2015_mol_ecol_accepted_sm.jpg,https://objects.lib.uidaho.edu/nitrogen-gradient/thumbs/freedman_2015_mol_ecol_accepted_th.jpg,"PDF was shared on original site, but unable to determine rights status, so currently changed to record only item."
ng_pub_013,Forest floor community metatranscriptomes identify fungal and bacterial responses to N deposition in two maple forests,,2015,"Hesse, C.N., R.C. Mueller, M. Vuyisich, L.V. Gallegos-Graves, C.D. Gleasner, D.R. Zak, and C. R. Kuske",,,Article,,,,"Frontiers in Microbiology, Volume 6, 2015 DOI:10.3389/fmicb.2015.00337",Text,,,,https://webpages.uidaho.edu/nitrogen-gradient/Publications/Hesse_Frontiers_2015.pdf,hesse_frontiers_2015.pdf,record,https://doi.org/10.3389/fmicb.2015.00337,https://objects.lib.uidaho.edu/nitrogen-gradient/small/hesse_frontiers_2015_sm.jpg,https://objects.lib.uidaho.edu/nitrogen-gradient/thumbs/hesse_frontiers_2015_th.jpg,"PDF was shared on original site, but unable to determine rights status, so currently changed to record only item."
ng_pub_014,Soil Bacterial Communities are Shaped by Temporal and Environmental Filtering: Evidence from a Long‐Term Chronosequence,,2015,"Freedman, Z., and D.R. Zak",,,Article,,,,"Environmental Microbiology, Volume 17, Issue 9, September 2015, DOI:10.1111/1462-2920.12762",Text,,,,https://webpages.uidaho.edu/nitrogen-gradient/Publications/Freedman_EnvMicro_2015.pdf,freedman_envmicro_2015.pdf,record,https://doi.org/10.1111/1462-2920.12762,https://objects.lib.uidaho.edu/nitrogen-gradient/small/freedman_envmicro_2015_sm.jpg,https://objects.lib.uidaho.edu/nitrogen-gradient/thumbs/freedman_envmicro_2015_th.jpg,"PDF was shared on original site, but unable to determine rights status, so currently changed to record only item."
ng_pub_015,Atmospheric N Deposition Increases Bacterial Laccase-Like Multicopper Oxidases: Implications for Organic Matter Decay,,2014,"Freedman, Z., and D.R. Zak",,,Article,,,,"Applied and Environmental Microbiology, Vol. 80, No. 14, https://doi.org/10.1128/AEM.01224-14",Text,,,,https://webpages.uidaho.edu/nitrogen-gradient/Publications/Freedman_2014_AEM.pdf,freedman_2014_aem.pdf,record,https://doi.org/10.1128/AEM.01224-14,https://objects.lib.uidaho.edu/nitrogen-gradient/small/freedman_2014_aem_sm.jpg,https://objects.lib.uidaho.edu/nitrogen-gradient/thumbs/freedman_2014_aem_th.jpg,"PDF was shared on original site, but unable to determine rights status, so currently changed to record only item."
ng_pub_016,Trophic stability of soil oribatid mites in the face of environmental change,,2014,"Gan, H., D.R. Zak, and M.D. Hunter",,,Article,,,,"Soil Biology and Biochemistry, Volume 68, January 2014, https://doi.org/10.1016/j.soilbio.2013.09.019",Text,,,,https://webpages.uidaho.edu/nitrogen-gradient/Publications/Gan_2014.pdf,gan_2014.pdf,record,https://doi.org/10.1016/j.soilbio.2013.09.019,https://objects.lib.uidaho.edu/nitrogen-gradient/small/gan_2014_sm.jpg,https://objects.lib.uidaho.edu/nitrogen-gradient/thumbs/gan_2014_th.jpg,"PDF was shared on original site, but unable to determine rights status, so currently changed to record only item."
ng_pub_017,Ecosystem Succession and Nutrient Retention: Vitousek and Reiners' Hypothesis,,2014,"Zak, D.R.",,,Article,,,,"The Bulletin of the Ecological Society of America, Volume 95, July 2014, https://doi.org/10.1890/0012-9623-95.3.234",Text,,,,https://webpages.uidaho.edu/nitrogen-gradient/Publications/Zak_2014_Bulletin.pdf,zak_2014_bulletin.pdf,record,https://doi.org/10.1890/0012-9623-95.3.234,https://objects.lib.uidaho.edu/nitrogen-gradient/small/zak_2014_bulletin_sm.jpg,https://objects.lib.uidaho.edu/nitrogen-gradient/thumbs/zak_2014_bulletin_th.jpg,"PDF was shared on original site, but unable to determine rights status, so currently changed to record only item."
ng_pub_018,Long-term experimental nitrogen deposition alters the composition of the active fungal community in the forest floor,,2013,"Entwistle, E.M., D.R. Zak, and I.P. Edwards",,,Article,,,,"Soil Science Society of America Journal, Volume 77, Issue 5, https://doi.org/10.2136/sssaj2013.05.0179",Text,,,,https://webpages.uidaho.edu/nitrogen-gradient/Publications/Entwistle_2013.pdf,entwistle_2013.pdf,record,https://doi.org/10.2136/sssaj2013.05.0179,https://objects.lib.uidaho.edu/nitrogen-gradient/small/entwistle_2013_sm.jpg,https://objects.lib.uidaho.edu/nitrogen-gradient/thumbs/entwistle_2013_th.jpg,"PDF was shared on original site, but unable to determine rights status, so currently changed to record only item."
ng_pub_019,Towards a molecular understanding of N cycling in northern hardwood forests under future rates of N deposition,,2013,"Freedman, Z., S.D. Eisenlord, D.R. Zak, K. Xue, Z. He, and J. Zhou",,,Article,,,,"Soil Biology and Biochemistry, Volume 66, November 2013, https://doi.org/10.1016/j.soilbio.2013.07.010",Text,,,,https://webpages.uidaho.edu/nitrogen-gradient/Publications/Freedman et al 2013 Gradient molecular N cycling.pdf,freedman_et_al_2013_gradient_molecular_n_cycling.pdf,record,https://doi.org/10.1016/j.soilbio.2013.07.010,https://objects.lib.uidaho.edu/nitrogen-gradient/small/freedman_et_al_2013_gradient_molecular_n_cycling_sm.jpg,https://objects.lib.uidaho.edu/nitrogen-gradient/thumbs/freedman_et_al_2013_gradient_molecular_n_cycling_th.jpg,"PDF was shared on original site, but unable to determine rights status, so currently changed to record only item."
ng_pub_020,Chronic nitrogen deposition and the composition of active arbuscularmycorrhizal fungi,,2013,"van Diepen, L.T.A., E.M. Entwistle, and D.R. Zak",,,Article,,,,"Applied Soil Ecology, Volume 72, October 2013, https://doi.org/10.1016/j.apsoil.2013.05.012",Text,,,,https://webpages.uidaho.edu/nitrogen-gradient/Publications/van Diepen et al 2013 Gradient AM cmty comp.pdf,van_diepen_et_al_2013_gradient_am_cmty_comp.pdf,record,https://doi.org/10.1016/j.apsoil.2013.05.012,https://objects.lib.uidaho.edu/nitrogen-gradient/small/van_diepen_et_al_2013_gradient_am_cmty_comp_sm.jpg,https://objects.lib.uidaho.edu/nitrogen-gradient/thumbs/van_diepen_et_al_2013_gradient_am_cmty_comp_th.jpg,"PDF was shared on original site, but unable to determine rights status, so currently changed to record only item."
ng_pub_021,Chronic nitrogen deposition alters the structure and function of detrital food webs in a northern hardwood ecosystem,,2013,"Gan, H., D.R. Zak, and M.D. Hunter",,,Article,,,,"Ecological Applications, Volume 23, Issue 6, https://doi.org/10.1890/12-1895.1",Text,,,,https://webpages.uidaho.edu/nitrogen-gradient/Publications/Gan et al 2013 Gradient soil foodwebs.pdf,gan_et_al_2013_gradient_soil_foodwebs.pdf,record,https://doi.org/10.1890/12-1895.1,https://objects.lib.uidaho.edu/nitrogen-gradient/small/gan_et_al_2013_gradient_soil_foodwebs_sm.jpg,https://objects.lib.uidaho.edu/nitrogen-gradient/thumbs/gan_et_al_2013_gradient_soil_foodwebs_th.jpg,"PDF was shared on original site, but unable to determine rights status, so currently changed to record only item."
ng_pub_022,Chronic nitrogen deposition reduces the abundance of dominant forest understory and groundcover species,,2013,"Talhelm, A.F., A.J. Burton, K.S. Pregitzer, and M.A. Campione",,,Article,,,,"Forest Ecology and Management, Volume 293, April 2013, https://doi.org/10.1016/j.foreco.2012.12.020",Text,,,,,,record,https://doi.org/10.1016/j.foreco.2012.12.020,,,
ng_pub_023,Microbial mechanisms mediating increased soil C storage under elevated atmospheric N deposition,,2013,"Eisenlord, S.D., Z. Freedman, D.R. Zak, K. Xue, Z. He, and J. Zhou",,,Article,,,,"Applied and Environmental Microbiology, Vol. 80, No. 14, https://doi.org/10.1128/AEM.01224-14",Text,,,,,,record,https://doi.org/10.1128/AEM.03156-12,,,
ng_pub_024,Nitrogen saturation,,2012,"Pregitzer, K.S., and A.F. Talhelm",,,Article,,,,"Berkshire Encyclopedia of Sustainability, Volume 5",Text,,,,,,record,,,,
ng_pub_025,Sinks for nitrogen inputs in terrestrial ecosystems: a meta-analysis of 15N tracer field studies,,2012,"Templer, P.H., et al.",,,Article,,,,"Ecology, Volume 93, Issue 8, August 2012,  https://doi.org/10.1890/11-1146.1",Text,,,,https://webpages.uidaho.edu/nitrogen-gradient/Publications/Templer et al 2012 15N tracer meta analaysis.pdf,templer_et_al_2012_15n_tracer_meta_analaysis.pdf,record,https://doi.org/10.1890/11-1146.1,https://objects.lib.uidaho.edu/nitrogen-gradient/small/templer_et_al_2012_15n_tracer_meta_analaysis_sm.jpg,https://objects.lib.uidaho.edu/nitrogen-gradient/thumbs/templer_et_al_2012_15n_tracer_meta_analaysis_th.jpg,"PDF was shared on original site, but unable to determine rights status, so currently changed to record only item."
ng_pub_026,Dispersal limitation and the assembly of soil Actinobacteria communities in a long-term chronosequence,,2012,"Eisenlord, S.D., D.R. Zak, and R.A. Upchurch",,,Article,,,,"Ecology and Evolution, Volume 2, Issue 3, March 2012, https://doi.org/10.1002/ece3.210",Text,application/pdf,,,https://webpages.uidaho.edu/nitrogen-gradient/Publications/Eisenlord et al 2012 Actinobacteria cmty assembly chronosequence.pdf,eisenlord_et_al_2012_actinobacteria_cmty_assembly_chronosequence.pdf,pdf,https://objects.lib.uidaho.edu/nitrogen-gradient/eisenlord_et_al_2012_actinobacteria_cmty_assembly_chronosequence.pdf,https://objects.lib.uidaho.edu/nitrogen-gradient/small/eisenlord_et_al_2012_actinobacteria_cmty_assembly_chronosequence_sm.jpg,https://objects.lib.uidaho.edu/nitrogen-gradient/thumbs/eisenlord_et_al_2012_actinobacteria_cmty_assembly_chronosequence_th.jpg,
ng_pub_027,Chronic N Deposition Does Not Apparently Alter the Biochemical Composition of Forest Floor and Soil Organic Matter,,2012,"Thomas, D.C., D.R. Zak, and T.R. Filley",,,Article,,,,"Soil Biology and Biochemistry, Volume 54, November 2012, https://doi.org/10.1016/j.soilbio.2012.05.010",Text,,,,https://webpages.uidaho.edu/nitrogen-gradient/Publications/Thomas et al 2012 N deposition soil C chemistry.pdf,thomas_et_al_2012_n_deposition_soil_c_chemistry.pdf,record,https://doi.org/10.1016/j.soilbio.2012.05.010,https://objects.lib.uidaho.edu/nitrogen-gradient/small/thomas_et_al_2012_n_deposition_soil_c_chemistry_sm.jpg,https://objects.lib.uidaho.edu/nitrogen-gradient/thumbs/thomas_et_al_2012_n_deposition_soil_c_chemistry_th.jpg,"PDF was shared on original site, but unable to determine rights status, so currently changed to record only item."
ng_pub_028,Anthropogenic N Deposition Increases Soil C Storage by Decreasing the Extent of Litter Decay: Analysis of Field Observations with an Ecosystem Model,,2012,"Whittinghill, K.A., W.S. Currie, D.R. Zak, A.J. Burton, and K.S. Pregitzer",,,Article,,,,"Ecosystems, Volume 15, February 2012, https://doi.org/10.1007/s10021-012-9521-7",Text,,,,https://webpages.uidaho.edu/nitrogen-gradient/Publications/Whittinghill et al 2012 Gradient Litter Decomp Model.pdf,whittinghill_et_al_2012_gradient_litter_decomp_model.pdf,record,https://doi.org/10.1007/s10021-012-9521-7,https://objects.lib.uidaho.edu/nitrogen-gradient/small/whittinghill_et_al_2012_gradient_litter_decomp_model_sm.jpg,https://objects.lib.uidaho.edu/nitrogen-gradient/thumbs/whittinghill_et_al_2012_gradient_litter_decomp_model_th.jpg,"PDF was shared on original site, but unable to determine rights status, so currently changed to record only item."
ng_pub_029,Air pollution and the changing biogeochemistry of northern forests,,2012,"Talhelm, A.F., K.S. Pregitzer, A.J. Burton, and D.R. Zak",,,Article,,,,"Frontiers in Ecology and the Environment, Volume 10, Issue 4,  https://doi.org/10.1890/110007",Text,,,,,,record,https://doi.org/10.1890/110007,,,
ng_pub_030,Simulated N deposition negatively impacts sugar maple regeneration in a northern hardwood ecosystem,,2011,"Patterson, S.L., D.R. Zak, A.J. Burton, A.F. Talhelm, and K.S. Pregitzer",,,Article,,,,"Journal of Applied Ecology, Volume 49, Issue 1, February 2012,  https://doi.org/10.1111/j.1365-2664.2011.02090.x",Text,,,,https://webpages.uidaho.edu/nitrogen-gradient/Publications/Patterson et al 2011 Gradient HM Seedlings.pdf,patterson_et_al_2011_gradient_hm_seedlings.pdf,record,https://doi.org/10.1111/j.1365-2664.2011.02090.x,https://objects.lib.uidaho.edu/nitrogen-gradient/small/patterson_et_al_2011_gradient_hm_seedlings_sm.jpg,https://objects.lib.uidaho.edu/nitrogen-gradient/thumbs/patterson_et_al_2011_gradient_hm_seedlings_th.jpg,"PDF was shared on original site, but unable to determine rights status, so currently changed to record only item."
ng_pub_031,Chronic N deposition alters root respiration-tissue N relationship in northern hardwoods forests,,2011,"Burton, A.J., J.C. Jarvey, M.P. Jarvi, D.R. Zak, and K.S. Pregitzer",,,Article,,,,"Global Change Biology, Volume 18, Issue 1, January 2012, https://doi.org/10.1111/j.1365-2486.2011.02527.x",Text,,,,https://webpages.uidaho.edu/nitrogen-gradient/Publications/Burton et al 2011 Root respiration N concentration.pdf,burton_et_al_2011_root_respiration_n_concentration.pdf,record,https://doi.org/10.1111/j.1365-2486.2011.02527.x,https://objects.lib.uidaho.edu/nitrogen-gradient/small/burton_et_al_2011_root_respiration_n_concentration_sm.jpg,https://objects.lib.uidaho.edu/nitrogen-gradient/thumbs/burton_et_al_2011_root_respiration_n_concentration_th.jpg,"PDF was shared on original site, but unable to determine rights status, so currently changed to record only item."
ng_pub_032,"Mercury distribution across 14 U.S. forests. Part I: Spatial patterns of concentrations in biomass, litter, and soils",,2011,"Obrist, D., et al.",,,Article,,,,"Michigan Nitrogen Deposition Gradient Study, University of Idaho",Text,application/pdf,,,https://webpages.uidaho.edu/nitrogen-gradient/Publications/Obrist et al 2011 Hg Pools US Forests.pdf,obrist_et_al_2011_hg_pools_us_forests.pdf,pdf,https://objects.lib.uidaho.edu/nitrogen-gradient/obrist_et_al_2011_hg_pools_us_forests.pdf,https://objects.lib.uidaho.edu/nitrogen-gradient/small/obrist_et_al_2011_hg_pools_us_forests_sm.jpg,https://objects.lib.uidaho.edu/nitrogen-gradient/thumbs/obrist_et_al_2011_hg_pools_us_forests_th.jpg,
ng_pub_033,Simulated atmospheric N deposition alters fungal community composition and suppresses ligninolytic gene expression in a northern hardwood forest,,2011,"Edwards, I.P., D.R. Zak, H. Kellner, S.D. Eisenlord, and K.S. Pregitzer",,,Article,,,,"Michigan Nitrogen Deposition Gradient Study, University of Idaho",Text,,,,,,record,http://www.plosone.org/article/info%3Adoi%2F10.1371%2Fjournal.pone.0020421,,,
ng_pub_034,No evidence that chronic nitrogen additions increase photosynthesis in mature sugar maple forests,,2011,"Talhelm, A.F., K.S. Pregitzer, and A.J. Burton",,,Article,,,,"Michigan Nitrogen Deposition Gradient Study, University of Idaho",Text,,,,,,record,http://www.esajournals.org/doi/abs/10.1890/10-2076.1,,,
ng_pub_035,Microbial responses to a changing environment: implications for the future functioning of terrestrial ecosystems,,2011,"Zak, D.R., K.S. Pregitzer, A.J. Burton, I.P. Edwards, and H. Kellner",,,Article,,,,"Fungal Ecology, Volume 4, Issue 6, 2011, DOI:10.1016/j.funeco.2011.04.001",Text,,,,https://webpages.uidaho.edu/nitrogen-gradient/Publications/Zak et al 2011 Microbial responses N dep.pdf,zak_et_al_2011_microbial_responses_n_dep.pdf,record,https://doi.org/10.1016/j.funeco.2011.04.001,https://objects.lib.uidaho.edu/nitrogen-gradient/small/zak_et_al_2011_microbial_responses_n_dep_sm.jpg,https://objects.lib.uidaho.edu/nitrogen-gradient/thumbs/zak_et_al_2011_microbial_responses_n_dep_th.jpg,"PDF was shared on original site, but unable to determine rights status, so currently changed to record only item."
ng_pub_036,Simulated nitrogen deposition affects community structure of arbuscular mycorrhizal fungi in northern hardwood forests,,2011,"van Diepen, L.T.A., E.A. Lilleskov, and K.S. Pregitzer",,,Article,,,,"Molecular Ecology, Volume 20, Issue 4, February 2011, https://doi.org/10.1111/j.1365-294X.2010.04969.x",Text,,,,https://webpages.uidaho.edu/nitrogen-gradient/Publications/van Diepen et al 2011 AM community structure Gradient.pdf,van_diepen_et_al_2011_am_community_structure_gradient.pdf,record,https://doi.org/10.1111/j.1365-294X.2010.04969.x,https://objects.lib.uidaho.edu/nitrogen-gradient/small/van_diepen_et_al_2011_am_community_structure_gradient_sm.jpg,https://objects.lib.uidaho.edu/nitrogen-gradient/thumbs/van_diepen_et_al_2011_am_community_structure_gradient_th.jpg,"PDF was shared on original site, but unable to determine rights status, so currently changed to record only item."
ng_pub_037,Nitrogen turnover in the leaf litter and fine roots of sugar maple,,2010,"Pregitzer, K.S., D.R. Zak, A.F. Talhelm, A.J. Burton, and J.R. Eikenberry.",,,Article,,,,"Ecology, Volume 91, Issue 12, https://doi.org/10.1890/10-0633.1",Text,,,,https://webpages.uidaho.edu/nitrogen-gradient/Publications/Pregitzer et al 2010 Gradient 15N Turnover.pdf,pregitzer_et_al_2010_gradient_15n_turnover.pdf,record,https://doi.org/10.1890/10-0633.1,https://objects.lib.uidaho.edu/nitrogen-gradient/small/pregitzer_et_al_2010_gradient_15n_turnover_sm.jpg,https://objects.lib.uidaho.edu/nitrogen-gradient/thumbs/pregitzer_et_al_2010_gradient_15n_turnover_th.jpg,"PDF was shared on original site, but unable to determine rights status, so currently changed to record only item."
ng_pub_038,Simulated nitrogen deposition causes a decline of intra- and extraradical abundance of arbuscular mycorrhizal fungi and changes in microbial community structure in northern hardwood forests,,2010,"van Diepen, L.T.A., E.A. Lilleskov, K.S. Pregitzer, and R.M. Miller",,,Article,,,,"Ecosystems, Volume 13, June 2010, https://doi.org/10.1007/s10021-010-9347-0",Text,,,,https://webpages.uidaho.edu/nitrogen-gradient/Publications/van Diepen et al 2010 AM abundance.pdf,van_diepen_et_al_2010_am_abundance.pdf,record,https://doi.org/10.1007/s10021-010-9347-0,https://objects.lib.uidaho.edu/nitrogen-gradient/small/van_diepen_et_al_2010_am_abundance_sm.jpg,https://objects.lib.uidaho.edu/nitrogen-gradient/thumbs/van_diepen_et_al_2010_am_abundance_th.jpg,"PDF was shared on original site, but unable to determine rights status, so currently changed to record only item."
ng_pub_039,Simulated Atmospheric Nitrogen Deposition Alters Actinobacterial Community Composition in Forest Soils,,2010,"Eisenlord, S.D., and D.R. Zak",,,Article,,,,"Soil Science Society of America Journal, Volume 74, Issue 4, https://doi.org/10.2136/sssaj2009.0240",Text,,,,https://webpages.uidaho.edu/nitrogen-gradient/Publications/Eisenlord and Zak 2010 SSSAJ.pdf,eisenlord_and_zak_2010_sssaj.pdf,record,https://doi.org/10.2136/sssaj2009.0240,https://objects.lib.uidaho.edu/nitrogen-gradient/small/eisenlord_and_zak_2010_sssaj_sm.jpg,https://objects.lib.uidaho.edu/nitrogen-gradient/thumbs/eisenlord_and_zak_2010_sssaj_th.jpg,"PDF was shared on original site, but unable to determine rights status, so currently changed to record only item."
ng_pub_040,Fungi unearthed: transcripts encoding lignocellulolytic and chitinolyic enzymes in forest soil,,2010,"Kellner, H., D.R. Zak, and M. Vandenbol.",,,Article,,,,Fungi unearthed: transcripts encoding lignocellulolytic and chitinolyic enzymes in forest soil,Text,,,,,,record,http://www.plosone.org/article/info%3Adoi%2F10.1371%2Fjournal.pone.0010971,,,
ng_pub_041,Are basidiomycete laccase gene abundance and composition related to reduced lignolytic activity under elevated atmospheric NO,,2009,"Hassett, J.E., D.R. Zak, C.B. Blackwood, and K.S. Pregitzer",,,Article,,,,"Microbial Ecology, Volume 57, September 2008, https://doi.org/10.1007/s00248-008-9440-5",Text,,,,https://webpages.uidaho.edu/nitrogen-gradient/Publications/Hassett_2009_Microbial_Ecology.pdf,hassett_2009_microbial_ecology.pdf,record,https://doi.org/10.1007/s00248-008-9440-5,https://objects.lib.uidaho.edu/nitrogen-gradient/small/hassett_2009_microbial_ecology_sm.jpg,https://objects.lib.uidaho.edu/nitrogen-gradient/thumbs/hassett_2009_microbial_ecology_th.jpg,"PDF was shared on original site, but unable to determine rights status, so currently changed to record only item."
ng_pub_042,Detection of fungal type I polyketide synthase genes in a forest soil,,2009,"Kellner, H., and D.R. Zak",,,Article,,,,"Soil Biology and Biochemistry, Volume 41, Issue 6, June 2009, https://doi.org/10.1016/j.soilbio.2009.02.033",Text,,,,https://webpages.uidaho.edu/nitrogen-gradient/Publications/Kellner_2009_Soil_Bio.pdf,kellner_2009_soil_bio.pdf,record,https://doi.org/10.1016/j.soilbio.2009.02.033,https://objects.lib.uidaho.edu/nitrogen-gradient/small/kellner_2009_soil_bio_sm.jpg,https://objects.lib.uidaho.edu/nitrogen-gradient/thumbs/kellner_2009_soil_bio_th.jpg,"PDF was shared on original site, but unable to determine rights status, so currently changed to record only item."
ng_pub_043,Respiration from roots and the mycorrhizosphere,,2009,"Moyano, F.E., O.K. Atkin, M. Bahn, D. Bruhn, A.J. Burton, A. Heinemeyer, W.L. Kutsch, and G. Wieser",,,Article,,,,"Soil Carbon Dynamics: An Integrated Methodology, Chap. 7, https://doi.org/10.1017/CBO9780511711794.008",Text,,,,,,record,https://doi.org/10.1017/CBO9780511711794.008,,,
ng_pub_044,"Measuring forest floor, mineral soil, and root carbon stocks",,2008,"Burton, A.J., and K.S. Pregitzer",,,Article,,,,"Field Measurements for Forest Carbon Monitoring, Chap. 10, 2008, https://doi.org/10.1007/978-1-4020-8506-2_10",Text,,,,,,record,https://doi.org/10.1007/978-1-4020-8506-2_10,,,
ng_pub_045,Chronic atmospheric NO<sub>3</sub><sup>−</sup> deposition does not induce NO<sub>3</sub><sup>−</sup> use by <i>Acer saccharum</i> Marsh,,2008,"Eddy, W.E., D.R. Zak, W.E. Holmes, and K.S. Pregitzer",,,Article,,,,"Ecosystems, Volume 11, March 2008, https://doi.org/10.1007/s10021-008-9134-3",Text,,,,https://webpages.uidaho.edu/nitrogen-gradient/Publications/Eddy_2008_Ecosystems.pdf,eddy_2008_ecosystems.pdf,record,https://doi.org/10.1007/s10021-008-9134-3,https://objects.lib.uidaho.edu/nitrogen-gradient/small/eddy_2008_ecosystems_sm.jpg,https://objects.lib.uidaho.edu/nitrogen-gradient/thumbs/eddy_2008_ecosystems_th.jpg,"PDF was shared on original site, but unable to determine rights status, so currently changed to record only item."
ng_pub_046,Simulated chronic nitrogen deposition increases carbon storage in northern temperate forests,,2008,"Pregitzer, K.S., A.J. Burton, D.R. Zak, and A.F. Talhelm",,,Article,,,,"Global Change Biology, Volume 14, Issue 1, September 2007, https://doi.org/10.1111/j.1365-2486.2007.01465.x",Text,,,,https://webpages.uidaho.edu/nitrogen-gradient/Publications/Pregitzer_2008_Global_Change_Biology.pdf,pregitzer_2008_global_change_biology.pdf,record,https://doi.org/10.1111/j.1365-2486.2007.01465.x,https://objects.lib.uidaho.edu/nitrogen-gradient/small/pregitzer_2008_global_change_biology_sm.jpg,https://objects.lib.uidaho.edu/nitrogen-gradient/thumbs/pregitzer_2008_global_change_biology_th.jpg,"PDF was shared on original site, but unable to determine rights status, so currently changed to record only item."
