objectid,parentid,title,presenter,presenter_affiliation,description,conference-year,date,start_time,end_time,duration_minutes,location,session-type,type,format,subject,identifier,display_template,object_location,image_small,image_thumb
sss2026-martin-kidder,,"Many Nations, One Family: Centering Community and Culture for Success",Steven Martin; Dakota Kidder,"Tribal Nations Student Affairs, Office of Tribal Relations","The Office of Tribal Nations Student Affairs presents an overview of its history and evolution, highlighting recruitment, retention, and programming that support Native American students at the University of Idaho. The session examines how cultural knowledge and tribal identities foster belonging.",2026,2026-02-27,2:00 PM,2:30 PM,30,Horizon,presentation,text,record,tribal nations;belonging;culture,,session,,https://objects.lib.uidaho.edu/student-success-symposium/small/martin-ppt_sm.jpg,https://objects.lib.uidaho.edu/student-success-symposium/thumbs/martin-ppt_th.jpg
sss2026-martin-kidder-abstract,sss2026-martin-kidder,"Abstract: Many Nations, One Family: Centering Community and Culture of Success",Steven Martin; Dakota Kidder,"Tribal Nations Student Affairs, University of Idaho","Extended abstract describing the Office of Tribal Nations Student Affairs (TNSA) comprehensive model integrating recruitment, retention, and culturally responsive programming through campus-wide collaboration. Centers Indigenous knowledge, identity, and community as foundations for Native American student success. Reports that TNSA-engaged Native students exceed the overall university retention rate, with stronger belonging and improved navigation of campus systems.",2026,2026-02-27,,,,,abstract,text,application/pdf,Native American student success;recruitment and retention;culturally responsive programming;belonging;tribal identity,martin-abs,pdf,https://objects.lib.uidaho.edu/student-success-symposium/martin-abs.pdf,https://objects.lib.uidaho.edu/student-success-symposium/small/martin-abs_sm.jpg,https://objects.lib.uidaho.edu/student-success-symposium/thumbs/martin-abs_th.jpg
sss2026-martin-kidder-slides,sss2026-martin-kidder,"Slides: Many Nations, One Family: Centering Community and Culture of Success",Steven Martin; Dakota Kidder,"Tribal Nations Student Affairs, University of Idaho","Presentation slides outlining the TNSA model for advancing Native American student success through coordinated recruitment, retention, and culturally responsive programming. Highlights partnerships with admissions, financial aid, advising, and faculty, alongside academic success workshops, cultural events, and leadership development grounded in tribal identity and community.",2026,2026-02-27,,,,,slides,text,application/pdf,Native American student success;recruitment and retention;culturally responsive programming;belonging;tribal identity,martin-ppt,pdf,https://objects.lib.uidaho.edu/student-success-symposium/martin-ppt.pdf,https://objects.lib.uidaho.edu/student-success-symposium/small/martin-ppt_sm.jpg,https://objects.lib.uidaho.edu/student-success-symposium/thumbs/martin-ppt_th.jpg
sss2026-perry-and-akervall,,Why Write? Teaching People in the Age of AI,Emma Catherine Perry; Miriam Åkervall,"Writing Center, English Department, CLASS; Writing Center, English Department, CLASS","This session examines the impact of generative AI on writing in postsecondary education and reaffirms writing's central role in student learning, achievement, and critical thinking. Participants explore the value of writing for learning within their disciplines and design ready-to-implement writing activities.",2026,2026-02-27,1:30 PM,2:30 PM,60,Crest,workshop,text,record,writing;AI;critical thinking,,session,,https://objects.lib.uidaho.edu/student-success-symposium/small/perry-and-akervall_abs_sm.jpg,https://objects.lib.uidaho.edu/student-success-symposium/thumbs/perry-and-akervall_abs_th.jpg
sss2026-perry-and-akervall-abstract,sss2026-perry-and-akervall,Abstract: Why Write? Teaching People in the Age of AI,Emma Catherine Perry; Miriam Åkervall,University of Idaho Writing Center,"Workshop abstract on the value of human-produced writing for student learning, achievement, and metacognition in an era of generative AI. Faculty and student support professionals reflect on writing-to-learn experiences, then design ready-to-implement writing activities through structured discussion, reflection, and small-group brainstorming. Emphasizes ungrading, scaffolding, and student agency in genre and subject matter as best practices.",2026,2026-02-27,,,,,abstract,text,application/pdf,writing;peer tutoring;efficacy;rhetoric;ethical AI;AI refusal;writing-to-learn,perry-and-akervall_abs,pdf,https://objects.lib.uidaho.edu/student-success-symposium/perry-and-akervall_abs.pdf,https://objects.lib.uidaho.edu/student-success-symposium/small/perry-and-akervall_abs_sm.jpg,https://objects.lib.uidaho.edu/student-success-symposium/thumbs/perry-and-akervall_abs_th.jpg
sss2026-perry-and-akervall-slides,sss2026-perry-and-akervall,Slides: Why Write? Teaching People in the Age of AI,Emma Catherine Perry; Miriam Åkervall,University of Idaho Writing Center,"Workshop slides presenting the rationale and strategies for incorporating human-produced writing into courses across the disciplines amid the rise of generative AI. Covers writing-to-learn pedagogies, ungrading, scaffolding, and student agency in genre and subject matter, with structured prompts for participant reflection and lesson design.",2026,2026-02-27,,,,,slides,text,application/pdf,writing;peer tutoring;efficacy;rhetoric;ethical AI;AI refusal;writing-to-learn,perry-and-akervall-ppt,pdf,https://objects.lib.uidaho.edu/student-success-symposium/perry-and-akervall-ppt.pdf,https://objects.lib.uidaho.edu/student-success-symposium/small/perry-and-akervall_ppt_sm.jpg,https://objects.lib.uidaho.edu/student-success-symposium/thumbs/perry-and-akervall_ppt_th.jpg
sss2026-program,,2026 Student Success Symposium Program: Ignite and Elevate,Student Success Symposium Planning Committee,"Center for Excellence in Teaching & Learning, University of Idaho","Official program for the 2026 University of Idaho Student Success Symposium, featuring the full schedule, session descriptions, and planning committee. Theme: Ignite and Elevate: Teaching for Student Persistence.",2026,2026-02-27,11:30 AM,4:30 PM,300,Idaho Student Union Building,program,text,application/pdf,student success;persistence;higher education;teaching and learning,2026program,pdf,https://objects.lib.uidaho.edu/student-success-symposium/2026program.pdf,https://objects.lib.uidaho.edu/student-success-symposium/small/2026program_sm.jpg,https://objects.lib.uidaho.edu/student-success-symposium/thumbs/2026program_th.jpg
sss2026-rowley,,High-Intensity and Independent Laboratory Research to Enhance Undergraduate Student Engagement and Success,Paul Rowley,"Biological Sciences, College of Science","This session outlines the history of undergraduate research productivity in lab-based biological sciences, highlighting student successes and evidence of productivity gains through independent research experiences. It also addresses challenges related to cohort management, future program development, and the integration of AI.",2026,2026-02-27,2:45 PM,3:15 PM,30,Crest,presentation,text,record,undergraduate research;biology;mentorship,,session,,,
sss2026-townsend,,Providing the Right Evidence: How Campus Interactions Shape Student Perceptions and Persistence,Kaylena Townsend,"Advising Services, SEM","This interactive session examines how students interpret everyday experiences and feedback as evidence of their abilities and potential. It explores how faculty, staff, and campus partners can intentionally shape classroom interactions, advising conversations, policies, and informal moments to support growth-minded perspectives and student persistence.",2026,2026-02-27,1:00 PM,1:30 PM,30,Panorama,presentation,text,record,advising;growth mindset;persistence,,session,,https://objects.lib.uidaho.edu/student-success-symposium/small/townsend-ppt_sm.jpg,https://objects.lib.uidaho.edu/student-success-symposium/thumbs/townsend-ppt_th.jpg
sss2026-townsend-abstract,sss2026-townsend,Abstract: Providing the Right Evidence: How Campus Interactions Shape Student Perceptions and Persistence,Kaylena Townsend,"Advising Services, University of Idaho","Extended abstract exploring how micro-messages in everyday campus interactions shape students' perceived academic control, motivation, and persistence. Draws on attribution theory, growth mindset, and appreciative advising research. Includes a case study approach and a Micro-Messages that Matter handout.",2026,2026-02-27,,,,,abstract,text,application/pdf,micro-messaging;perceived academic control;growth mindset;appreciative advising,townsend-abs,pdf,https://objects.lib.uidaho.edu/student-success-symposium/townsend-abs.pdf,https://objects.lib.uidaho.edu/student-success-symposium/small/townsend-abs_sm.jpg,https://objects.lib.uidaho.edu/student-success-symposium/thumbs/townsend-abs_th.jpg
sss2026-townsend-slides,sss2026-townsend,Slides: Providing the Right Evidence: How Campus Interactions Shape Student Perceptions and Persistence,Kaylena Townsend,"Advising Services, University of Idaho","Presentation slides exploring how micro-messages in everyday campus interactions influence students' perceived academic control and persistence. Includes case study exercises, the Micro-Messages that Matter framework, and strategies grounded in attribution theory, growth mindset, and appreciative advising.",2026,2026-02-27,,,,,slides,text,application/pdf,micro-messaging;perceived academic control;growth mindset;appreciative advising,townsend-ppt,pdf,https://objects.lib.uidaho.edu/student-success-symposium/townsend-ppt.pdf,https://objects.lib.uidaho.edu/student-success-symposium/small/townsend-ppt_sm.jpg,https://objects.lib.uidaho.edu/student-success-symposium/thumbs/townsend-ppt_th.jpg
sss2026-voss-gash-hoene,,The Why of Accommodations: Case Studies,Cory Voss; Katelyn Gash; Jeneba Hoene,"Center for Disability, Accessibility & Resources, Dean of Students","This interactive session uses real case studies to explore the purpose and practice of disability-related accommodations and how they support student success. Participants examine instructional barriers, distinguish essential requirements from flexible practices, and learn how Universal Design for Learning strategies can reduce the need for reactive accommodations.",2026,2026-02-27,1:30 PM,2:30 PM,60,Panorama,workshop,text,record,accommodations;UDL;accessibility,,session,,https://objects.lib.uidaho.edu/student-success-symposium/small/voss-ppt_sm.jpg,https://objects.lib.uidaho.edu/student-success-symposium/thumbs/voss-ppt_th.jpg
sss2026-voss-gash-hoene-abstract,sss2026-voss-gash-hoene,Abstract: The 'Why' of Accommodations with Case Studies,Cory Voss,"Center for Disability Access and Resources, University of Idaho","Extended abstract presenting a barrier-removal framework for understanding disability accommodations under the ADA and Section 504. Uses structured case studies that examine functional limitations, course-design barriers, approved accommodations, and rationale, helping faculty distinguish essential learning outcomes from instructional methods. Introduces Universal Design for Learning as a way to proactively reduce barriers and minimize the need for individual accommodations.",2026,2026-02-27,,,,,abstract,text,application/pdf,disability accommodations;ADA;Section 504;Universal Design for Learning;UDL;academic integrity;accessibility;faculty development;case studies,voss-abs,pdf,https://objects.lib.uidaho.edu/student-success-symposium/voss-abs.pdf,https://objects.lib.uidaho.edu/student-success-symposium/small/voss-abs_sm.jpg,https://objects.lib.uidaho.edu/student-success-symposium/thumbs/voss-abs_th.jpg
sss2026-voss-gash-hoene-slides,sss2026-voss-gash-hoene,Slides: The 'Why' of Accommodations with Case Studies,Cory Voss; Katelyn Gash; Jeneba Hoene,"Center for Disability Access and Resources, University of Idaho; Dean of Students, University of Idaho","Workshop slides presenting a barrier-removal framework for disability accommodations grounded in the ADA and Section 504. Walks through case studies analyzing functional limitations, course-design barriers, and the rationale for approved accommodations, and introduces Universal Design for Learning strategies that proactively reduce the need for reactive accommodations.",2026,2026-02-27,,,,,slides,text,application/pdf,disability accommodations;ADA;Section 504;Universal Design for Learning;UDL;academic integrity;accessibility;faculty development;case studies,voss-ppt,pdf,https://objects.lib.uidaho.edu/student-success-symposium/voss-ppt.pdf,https://objects.lib.uidaho.edu/student-success-symposium/small/voss-ppt_sm.jpg,https://objects.lib.uidaho.edu/student-success-symposium/thumbs/voss-ppt_th.jpg
sss2026-waynant,,How to Create a Positive Undergraduate Research Environment,Kristopher Waynant,"Office of Undergraduate Research; Chemistry, College of Science","This 60-minute workshop presents best practices for mentoring and engaging undergraduates in research at a research-intensive university. The session covers designing feasible projects, setting expectations, managing time and safety, and clarifying roles within research teams.",2026,2026-02-27,3:15 PM,4:15 PM,60,Crest,workshop,text,record,undergraduate research;mentorship;best practices,,session,,,
sss2026-ziegler,,Nurturing Academic Hope: Increasing Student Success Through an Active Framework of Hope,Amber Ziegler,"Advising Services, SEM","Hope is often thought of as a passive wish. Psychological and student development research give us an alternative framing of hope as an active concept, incorporating intention, reflection, and practice. This workshop introduces the framework of academic hope, explores its components, and inspires ideas for supporting students.",2026,2026-02-27,2:45 PM,3:15 PM,30,Panorama,workshop,text,record,academic hope;well-being;persistence,,session,,,